{
  "$id": "METHODS_INFORMATION_BENCHMARK_ASSIGNMENT_TRANSACTION_EVIDENCE_SCHEMA_v2",
  "$schema": "https://json-schema.org/draft/2020-12/schema",
  "additionalProperties": false,
  "properties": {
    "approvalSha256": {
      "pattern": "^[0-9a-f]{64}$",
      "type": "string"
    },
    "assignmentId": {
      "type": "string"
    },
    "authorizationSha256": {
      "pattern": "^[0-9a-f]{64}$",
      "type": "string"
    },
    "exactChangedPaths": {
      "const": [
        "control-plane/methods-information-benchmark/assignment-state/role6-first-atomic-assignment-v1/role6-operation-scoped-activation.record.v1.json",
        "control-plane/methods-information-benchmark/assignment-state/role6-first-atomic-assignment-v1/first-assignment-ledger.successor.v1.json",
        "control-plane/methods-information-benchmark/assignment-state/role6-first-atomic-assignment-v1/atomic-authorization-consumption.record.v1.json",
        "control-plane/methods-information-benchmark/assignment-state/role6-first-atomic-assignment-v1/role6-admission.receipt.v1.json",
        "control-plane/methods-information-benchmark/assignment-state/role6-first-atomic-assignment-v1/assignment-transaction.evidence.v1.json"
      ]
    },
    "generalRoleAuthorityActivated": {
      "const": false
    },
    "mergePerformed": {
      "const": false
    },
    "noncePredecessorHead": {
      "pattern": "^[0-9a-f]{64}$",
      "type": "string"
    },
    "nonceSuccessorHead": {
      "pattern": "^[0-9a-f]{64}$",
      "type": "string"
    },
    "packetCanonicalSha256": {
      "const": "5c93a8ebe638b9f06a4e14fc42f8ee202c8801e940527aa4fb987006a04e0cdc"
    },
    "packetSuccessorHead": {
      "const": "fa7e74403ff43e017bccef7462f4e001918cf0a3"
    },
    "predecessorLedgerHead": {
      "pattern": "^[0-9a-f]{64}$",
      "type": "string"
    },
    "result": {
      "const": "PASS_OPERATION_SCOPED_ASSIGNMENT_PREPARED"
    },
    "schema": {
      "const": "METHODS_INFORMATION_BENCHMARK_ASSIGNMENT_TRANSACTION_EVIDENCE_v2"
    },
    "substantiveAuditOutputsCreated": {
      "const": false
    },
    "successorLedgerHead": {
      "pattern": "^[0-9a-f]{64}$",
      "type": "string"
    }
  },
  "required": [
    "schema",
    "result",
    "assignmentId",
    "authorizationSha256",
    "approvalSha256",
    "packetSuccessorHead",
    "packetCanonicalSha256",
    "predecessorLedgerHead",
    "successorLedgerHead",
    "noncePredecessorHead",
    "nonceSuccessorHead",
    "exactChangedPaths",
    "substantiveAuditOutputsCreated",
    "generalRoleAuthorityActivated",
    "mergePerformed"
  ],
  "type": "object"
}
